{"business_mutation_performed":false,"limit":50,"matched_count":1,"namespace":"w2-explicit-cancel-7962b83a-de07-4010-b6cf-a59f606e63e2","next_cursor":null,"private_body_available_here":false,"projection":"runtime-records","read_at":"2026-10-23T06:48:48.216043+00:00","runs":[{"chat_id":"direct","configuration_id":"runtime-1","configuration_version":"1","cost_total":null,"dataset_id":"selection","dataset_version":"1","finished_at":"2026-10-23T06:48:48.202697+00:00","memory_reference":null,"model_attempts_coverage":"HTTP_REQUESTS_OBSERVED_ONLY","model_behavior_evaluation_passed":false,"model_completion_observed":false,"model_requests":[{"finish_reasons":["tool_calls"],"http_status":200,"model_request_id":"model-request-33f699b0-a83d-4277-a147-6f596dcf8afe","request_sha256":"1d526a230613de25d001286675414ce9dbaf4bd849e2dc6e052b3b5150620ee7","response_ids":["8a8c6b8a-a483-4f52-b904-3edfb2159440"],"tool_config_sha256":"9563f0d2a05988f272138a3a70f0842908edb2dc54dd155d17bf0be522fa0bad","usage":{"completion_tokens":332,"prompt_cache_hit_tokens":3200,"prompt_cache_miss_tokens":249,"prompt_tokens":3449,"total_tokens":3781}},{"finish_reasons":["tool_calls"],"http_status":200,"model_request_id":"model-request-178e3bf8-d27f-4e61-acf0-68158d626803","request_sha256":"db0c4a765a4510d7e62a21693c5e6a77b6ae5b7ab57b3ad63aaed812fa1fb65a","response_ids":["97ee8ff5-a51f-4b01-8cdb-ed5a0e5da9b8"],"tool_config_sha256":"9563f0d2a05988f272138a3a70f0842908edb2dc54dd155d17bf0be522fa0bad","usage":{"completion_tokens":122,"prompt_cache_hit_tokens":3712,"prompt_cache_miss_tokens":1161,"prompt_tokens":4873,"total_tokens":4995}},{"finish_reasons":[],"http_status":200,"model_request_id":"model-request-0fc5ecc0-b8cd-4dc5-9e8d-29a8926a0a4f","request_sha256":"c545ebef8d78caba24e30dfbd9b5ccda6e74e721ce4157c9037998c18dd07f2a","response_ids":["845ca2f3-0632-4670-af7c-45302481a53f"],"tool_config_sha256":"9563f0d2a05988f272138a3a70f0842908edb2dc54dd155d17bf0be522fa0bad","usage":null}],"namespace":"w2-explicit-cancel-7962b83a-de07-4010-b6cf-a59f606e63e2","price_version":null,"private_body_recorded":false,"prompt_versions":[],"request_id":"w2-explicit-cancel-7962b83a-de07-4010-b6cf-a59f606e63e2:1792738109303635000","request_id_source":"TURN","run_id":"run-1280f2ee-fb71-4b9c-9656-c72f19aefc9b","runtime":{"api_type":"chat_completions","config_sha256":"975087166431ca842d92f665530a21de43ff2f47767da135e54a75409d46d3d4","max_output_tokens":4096,"max_tool_rounds":12,"model_id":"deepseek-flash","provider":"deepseek","timeout":120},"session_id":"w2-explicit-cancel-7962b83a-de07-4010-b6cf-a59f606e63e2","started_at":"2026-10-23T06:48:29.373903+00:00","status":"CANCELED","stop_reason":"cancelled","tool_config_sha256":"9563f0d2a05988f272138a3a70f0842908edb2dc54dd155d17bf0be522fa0bad","tool_configuration":[{"implementation":"model_probe.BusinessTool","implementation_sha256":"06771039caad94e047a3217f27f6338263485a0dfb82bf2978dee820d2540775","schema_sha256":"c77cab6b9917b893ad4d5d84d95eee6c2fee08117ee8ce14c4b59d3dd1d48f9d","tool_id":"create_assignment"},{"implementation":"model_probe.BusinessTool","implementation_sha256":"06771039caad94e047a3217f27f6338263485a0dfb82bf2978dee820d2540775","schema_sha256":"51d2479a6389bdda317d75ce6e660cf7a0af948df655e28e76e5b77fff3397a1","tool_id":"query_metrics"},{"implementation":"model_probe.BusinessTool","implementation_sha256":"06771039caad94e047a3217f27f6338263485a0dfb82bf2978dee820d2540775","schema_sha256":"ad2ad30bb622de43fa9bd4f725f87b4134dbbf6bdcf9fdd65efef83dfbc15876","tool_id":"read_assignment"},{"implementation":"model_probe.BusinessTool","implementation_sha256":"06771039caad94e047a3217f27f6338263485a0dfb82bf2978dee820d2540775","schema_sha256":"88b733828298d2099c669938c09f057e0599443c98481a49c46f9c2b3c2de596","tool_id":"read_evidence"},{"implementation":"model_probe.BusinessTool","implementation_sha256":"06771039caad94e047a3217f27f6338263485a0dfb82bf2978dee820d2540775","schema_sha256":"b6ba085b5c6154aa64e73f13b795acb931d0dc9f6a7f6477024ce920a1bf42e1","tool_id":"send_assignment"}],"tool_results":[{"iteration":0,"query_id":"7ad07e32-b124-4f7f-bc06-e1d1c59b8dad","tool_call_id":"call_00_lkHS6dWOLLqyiZtHvyCD5071","tool_id":"query_metrics"},{"iteration":1,"tool_call_id":"call_00_CLJ9m2oyxWxLw0BzxUsb2233","tool_id":"read_evidence"}],"turn_id":"w2-explicit-cancel-7962b83a-de07-4010-b6cf-a59f606e63e2:1792738109303635000","usage":{"completion_tokens":454,"prompt_cache_hit_tokens":6912,"prompt_cache_miss_tokens":1410,"prompt_tokens":8322,"total_tokens":8776},"usage_coverage":"PARTIAL_OBSERVED_REQUESTS"}],"source_type":"RUNTIME_RECORD"}