{"business_mutation_performed":false,"limit":50,"matched_count":1,"namespace":"w2-request-timeout-20032263-3527-4dd2-a4de-41b577541e30","next_cursor":null,"private_body_available_here":false,"projection":"runtime-records","read_at":"2026-10-23T06:52:15.473358+00:00","runs":[{"chat_id":"direct","configuration_id":"runtime-1","configuration_version":"1","cost_total":null,"dataset_id":"selection","dataset_version":"1","finished_at":"2026-10-23T06:52:15.463818+00:00","memory_reference":null,"model_attempts_coverage":"HTTP_REQUESTS_OBSERVED_ONLY","model_behavior_evaluation_passed":false,"model_completion_observed":false,"model_requests":[{"finish_reasons":[],"http_status":200,"model_request_id":"model-request-c5df4b02-2ada-4bb9-b713-ddda14b35dfa","request_sha256":"a41401d2c548164ee1f39d1dd02eb94cf76b29cb37374c94c4acbe1c13b59fd0","response_ids":["b1f27ec2-9d74-4aff-bee4-35f2259201a2"],"tool_config_sha256":"9563f0d2a05988f272138a3a70f0842908edb2dc54dd155d17bf0be522fa0bad","usage":null}],"namespace":"w2-request-timeout-20032263-3527-4dd2-a4de-41b577541e30","price_version":null,"private_body_recorded":false,"prompt_versions":[],"request_id":"w2-request-timeout-20032263-3527-4dd2-a4de-41b577541e30:1792738332494402000","request_id_source":"TURN","run_id":"run-6535b9e6-08a5-43c1-af85-16032b5f4281","runtime":{"api_type":"chat_completions","config_sha256":"cd03370569634d2bfe140b228d11a89569f6f953a40cb4af0490124f44d579be","max_output_tokens":4096,"max_tool_rounds":12,"model_id":"deepseek-flash","provider":"deepseek","timeout":120},"session_id":"w2-request-timeout-20032263-3527-4dd2-a4de-41b577541e30","started_at":"2026-10-23T06:52:12.511875+00:00","status":"TIMED_OUT","stop_reason":"cancelled","termination_source":"CALLER_DEADLINE_EXPIRED","tool_config_sha256":"9563f0d2a05988f272138a3a70f0842908edb2dc54dd155d17bf0be522fa0bad","tool_configuration":[{"implementation":"model_probe.BusinessTool","implementation_sha256":"06771039caad94e047a3217f27f6338263485a0dfb82bf2978dee820d2540775","schema_sha256":"c77cab6b9917b893ad4d5d84d95eee6c2fee08117ee8ce14c4b59d3dd1d48f9d","tool_id":"create_assignment"},{"implementation":"model_probe.BusinessTool","implementation_sha256":"06771039caad94e047a3217f27f6338263485a0dfb82bf2978dee820d2540775","schema_sha256":"51d2479a6389bdda317d75ce6e660cf7a0af948df655e28e76e5b77fff3397a1","tool_id":"query_metrics"},{"implementation":"model_probe.BusinessTool","implementation_sha256":"06771039caad94e047a3217f27f6338263485a0dfb82bf2978dee820d2540775","schema_sha256":"ad2ad30bb622de43fa9bd4f725f87b4134dbbf6bdcf9fdd65efef83dfbc15876","tool_id":"read_assignment"},{"implementation":"model_probe.BusinessTool","implementation_sha256":"06771039caad94e047a3217f27f6338263485a0dfb82bf2978dee820d2540775","schema_sha256":"88b733828298d2099c669938c09f057e0599443c98481a49c46f9c2b3c2de596","tool_id":"read_evidence"},{"implementation":"model_probe.BusinessTool","implementation_sha256":"06771039caad94e047a3217f27f6338263485a0dfb82bf2978dee820d2540775","schema_sha256":"b6ba085b5c6154aa64e73f13b795acb931d0dc9f6a7f6477024ce920a1bf42e1","tool_id":"send_assignment"}],"tool_results":[],"turn_id":"w2-request-timeout-20032263-3527-4dd2-a4de-41b577541e30:1792738332494402000","usage":null,"usage_coverage":"PARTIAL_OBSERVED_REQUESTS"}],"source_type":"RUNTIME_RECORD"}