{"business_mutation_performed":false,"limit":50,"matched_count":1,"namespace":"w2-iteration-budget-f24b1b91-d698-4387-9537-22535d07543e","next_cursor":null,"private_body_available_here":false,"projection":"runtime-records","read_at":"2026-10-23T06:49:40.687960+00:00","runs":[{"chat_id":"direct","configuration_id":"runtime-1","configuration_version":"2","cost_total":null,"dataset_id":"selection","dataset_version":"1","finished_at":"2026-10-23T06:49:40.657691+00:00","memory_reference":null,"model_attempts_coverage":"HTTP_REQUESTS_OBSERVED_ONLY","model_behavior_evaluation_passed":false,"model_completion_observed":false,"model_requests":[{"finish_reasons":["tool_calls"],"http_status":200,"model_request_id":"model-request-8108a0de-f194-4cb5-a20b-9e8ee0ba6d26","request_sha256":"d008a29a18674b78fa6e981c2510e91763490011d3c5f3fd2929236234e82e17","response_ids":["f62c9353-5199-4cf8-9dbd-6f4fcdeff4f0"],"tool_config_sha256":"9563f0d2a05988f272138a3a70f0842908edb2dc54dd155d17bf0be522fa0bad","usage":{"completion_tokens":332,"prompt_cache_hit_tokens":3072,"prompt_cache_miss_tokens":372,"prompt_tokens":3444,"total_tokens":3776}}],"namespace":"w2-iteration-budget-f24b1b91-d698-4387-9537-22535d07543e","price_version":null,"private_body_recorded":false,"prompt_versions":[],"request_id":"w2-iteration-budget-f24b1b91-d698-4387-9537-22535d07543e:1792738164787468000","request_id_source":"TURN","run_id":"run-372407e4-42cb-45a2-8229-debf28795a51","runtime":{"api_type":"chat_completions","config_sha256":"a0701a2bed0ea4d071b859ccc7443242aaa75173b8a9e91abdcfbe07b94dedb5","max_output_tokens":4096,"max_tool_rounds":1,"model_id":"deepseek-flash","provider":"deepseek","timeout":120},"session_id":"w2-iteration-budget-f24b1b91-d698-4387-9537-22535d07543e","started_at":"2026-10-23T06:49:24.845803+00:00","status":"FAILED","stop_reason":"max_iterations","tool_config_sha256":"9563f0d2a05988f272138a3a70f0842908edb2dc54dd155d17bf0be522fa0bad","tool_configuration":[{"implementation":"model_probe.BusinessTool","implementation_sha256":"06771039caad94e047a3217f27f6338263485a0dfb82bf2978dee820d2540775","schema_sha256":"c77cab6b9917b893ad4d5d84d95eee6c2fee08117ee8ce14c4b59d3dd1d48f9d","tool_id":"create_assignment"},{"implementation":"model_probe.BusinessTool","implementation_sha256":"06771039caad94e047a3217f27f6338263485a0dfb82bf2978dee820d2540775","schema_sha256":"51d2479a6389bdda317d75ce6e660cf7a0af948df655e28e76e5b77fff3397a1","tool_id":"query_metrics"},{"implementation":"model_probe.BusinessTool","implementation_sha256":"06771039caad94e047a3217f27f6338263485a0dfb82bf2978dee820d2540775","schema_sha256":"ad2ad30bb622de43fa9bd4f725f87b4134dbbf6bdcf9fdd65efef83dfbc15876","tool_id":"read_assignment"},{"implementation":"model_probe.BusinessTool","implementation_sha256":"06771039caad94e047a3217f27f6338263485a0dfb82bf2978dee820d2540775","schema_sha256":"88b733828298d2099c669938c09f057e0599443c98481a49c46f9c2b3c2de596","tool_id":"read_evidence"},{"implementation":"model_probe.BusinessTool","implementation_sha256":"06771039caad94e047a3217f27f6338263485a0dfb82bf2978dee820d2540775","schema_sha256":"b6ba085b5c6154aa64e73f13b795acb931d0dc9f6a7f6477024ce920a1bf42e1","tool_id":"send_assignment"}],"tool_results":[{"iteration":0,"query_id":"2c958cd8-d3ba-4e09-912c-db683d379d89","tool_call_id":"call_00_zXxrNQZF59zQIh7Pvsxd4775","tool_id":"query_metrics"}],"turn_id":"w2-iteration-budget-f24b1b91-d698-4387-9537-22535d07543e:1792738164787468000","usage":{"completion_tokens":332,"prompt_cache_hit_tokens":3072,"prompt_cache_miss_tokens":372,"prompt_tokens":3444,"total_tokens":3776},"usage_coverage":"COMPLETE_OBSERVED_REQUESTS"}],"source_type":"RUNTIME_RECORD"}