{"business_mutation_performed":false,"limit":50,"matched_count":1,"namespace":"w2-written-client-closed-bc91c3e7-de85-48b4-9ff1-7751e1d78d31","next_cursor":null,"private_body_available_here":false,"projection":"runtime-records","read_at":"2026-10-23T06:48:24.628768+00:00","runs":[{"chat_id":"direct","configuration_id":"runtime-1","configuration_version":"1","cost_total":null,"dataset_id":"selection","dataset_version":"1","finished_at":"2026-10-23T06:48:23.577771+00:00","memory_reference":null,"model_attempts_coverage":"HTTP_REQUESTS_OBSERVED_ONLY","model_behavior_evaluation_passed":false,"model_completion_observed":false,"model_requests":[{"finish_reasons":["tool_calls"],"http_status":200,"model_request_id":"model-request-451a3a63-2421-4165-b538-05cc3908e2b4","request_sha256":"02aa0a0c8c93d9860fd5202cbcb18072e5c128bfe3179bd6f516550622ab7b61","response_ids":["f3e02621-635b-4454-baf1-d32c114806ec"],"tool_config_sha256":"9563f0d2a05988f272138a3a70f0842908edb2dc54dd155d17bf0be522fa0bad","usage":{"completion_tokens":233,"prompt_cache_hit_tokens":3200,"prompt_cache_miss_tokens":257,"prompt_tokens":3457,"total_tokens":3690}}],"namespace":"w2-written-client-closed-bc91c3e7-de85-48b4-9ff1-7751e1d78d31","price_version":null,"private_body_recorded":false,"prompt_versions":[],"request_id":"w2-written-client-closed-bc91c3e7-de85-48b4-9ff1-7751e1d78d31:1792738074764753000","request_id_source":"TURN","run_id":"run-8142c95f-18a3-47f5-873e-2d215928586f","runtime":{"api_type":"chat_completions","config_sha256":"5c85c46411333e6f84a2772890f48600a8b7f1fdb4280b5e8664250440535040","max_output_tokens":4096,"max_tool_rounds":12,"model_id":"deepseek-flash","provider":"deepseek","timeout":120},"session_id":"w2-written-client-closed-bc91c3e7-de85-48b4-9ff1-7751e1d78d31","started_at":"2026-10-23T06:47:54.798624+00:00","status":"FAILED","stop_reason":"error","tool_config_sha256":"9563f0d2a05988f272138a3a70f0842908edb2dc54dd155d17bf0be522fa0bad","tool_configuration":[{"implementation":"model_probe.BusinessTool","implementation_sha256":"06771039caad94e047a3217f27f6338263485a0dfb82bf2978dee820d2540775","schema_sha256":"c77cab6b9917b893ad4d5d84d95eee6c2fee08117ee8ce14c4b59d3dd1d48f9d","tool_id":"create_assignment"},{"implementation":"model_probe.BusinessTool","implementation_sha256":"06771039caad94e047a3217f27f6338263485a0dfb82bf2978dee820d2540775","schema_sha256":"51d2479a6389bdda317d75ce6e660cf7a0af948df655e28e76e5b77fff3397a1","tool_id":"query_metrics"},{"implementation":"model_probe.BusinessTool","implementation_sha256":"06771039caad94e047a3217f27f6338263485a0dfb82bf2978dee820d2540775","schema_sha256":"ad2ad30bb622de43fa9bd4f725f87b4134dbbf6bdcf9fdd65efef83dfbc15876","tool_id":"read_assignment"},{"implementation":"model_probe.BusinessTool","implementation_sha256":"06771039caad94e047a3217f27f6338263485a0dfb82bf2978dee820d2540775","schema_sha256":"88b733828298d2099c669938c09f057e0599443c98481a49c46f9c2b3c2de596","tool_id":"read_evidence"},{"implementation":"model_probe.BusinessTool","implementation_sha256":"06771039caad94e047a3217f27f6338263485a0dfb82bf2978dee820d2540775","schema_sha256":"b6ba085b5c6154aa64e73f13b795acb931d0dc9f6a7f6477024ce920a1bf42e1","tool_id":"send_assignment"}],"tool_results":[{"authorization_id":"f0dba074-cfc3-42df-b6ef-09794c01ede3","iteration":0,"status":"OPEN","task_id":"a11d0910-d79f-4144-8871-fe4ac16da38b","tool_call_id":"call_00_Fc0A9R8qbPU7w64St4hZ0323","tool_id":"create_assignment","version":"1"}],"turn_id":"w2-written-client-closed-bc91c3e7-de85-48b4-9ff1-7751e1d78d31:1792738074764753000","usage":{"completion_tokens":233,"prompt_cache_hit_tokens":3200,"prompt_cache_miss_tokens":257,"prompt_tokens":3457,"total_tokens":3690},"usage_coverage":"COMPLETE_OBSERVED_REQUESTS"}],"source_type":"RUNTIME_RECORD"}